[
  {
    "camera_id": "kodak_easyshare_m753",
    "display_name": "Kodak EasyShare M753",
    "brand": "Kodak",
    "series": "EasyShare M",
    "release_year": null,
    "reason": "Camera existence confirmed, battery not yet source-verified",
    "candidate_source_name": "Camera-wiki Kodak catalog",
    "candidate_source_url": "https://camera-wiki.org/wiki/Kodak",
    "checked_source_urls": [
      "https://camera-wiki.org/wiki/Kodak"
    ],
    "last_checked": "2026-05-24"
  },
  {
    "camera_id": "kodak_easyshare_m763",
    "display_name": "Kodak EasyShare M763",
    "brand": "Kodak",
    "series": "EasyShare M",
    "release_year": null,
    "reason": "Camera existence confirmed, battery not yet source-verified",
    "candidate_source_name": "Camera-wiki Kodak catalog",
    "candidate_source_url": "https://camera-wiki.org/wiki/Kodak",
    "checked_source_urls": [
      "https://camera-wiki.org/wiki/Kodak"
    ],
    "last_checked": "2026-05-24"
  },
  {
    "camera_id": "kodak_easyshare_m853",
    "display_name": "Kodak EasyShare M853",
    "brand": "Kodak",
    "series": "EasyShare M",
    "release_year": null,
    "reason": "Camera existence confirmed, battery not yet source-verified",
    "candidate_source_name": "Camera-wiki Kodak catalog",
    "candidate_source_url": "https://camera-wiki.org/wiki/Kodak",
    "checked_source_urls": [
      "https://camera-wiki.org/wiki/Kodak"
    ],
    "last_checked": "2026-05-24"
  },
  {
    "camera_id": "kodak_easyshare_md853",
    "display_name": "Kodak EasyShare MD853",
    "brand": "Kodak",
    "series": "EasyShare MD",
    "release_year": null,
    "reason": "Camera existence confirmed, battery not yet source-verified",
    "candidate_source_name": "Camera-wiki Kodak catalog",
    "candidate_source_url": "https://camera-wiki.org/wiki/Kodak",
    "checked_source_urls": [
      "https://camera-wiki.org/wiki/Kodak"
    ],
    "last_checked": "2026-05-24"
  },
  {
    "camera_id": "kodak_easyshare_md855",
    "display_name": "Kodak EasyShare MD855",
    "brand": "Kodak",
    "series": "EasyShare MD",
    "release_year": null,
    "reason": "Camera existence confirmed, battery not yet source-verified",
    "candidate_source_name": "Camera-wiki Kodak catalog",
    "candidate_source_url": "https://camera-wiki.org/wiki/Kodak",
    "checked_source_urls": [
      "https://camera-wiki.org/wiki/Kodak"
    ],
    "last_checked": "2026-05-24"
  },
  {
    "camera_id": "kodak_easyshare_p880",
    "display_name": "Kodak EasyShare P880",
    "brand": "Kodak",
    "series": "EasyShare P",
    "release_year": null,
    "reason": "Camera existence confirmed, battery not yet source-verified",
    "candidate_source_name": "Camera-wiki Kodak catalog",
    "candidate_source_url": "https://camera-wiki.org/wiki/Kodak",
    "checked_source_urls": [
      "https://camera-wiki.org/wiki/Kodak"
    ],
    "last_checked": "2026-05-24"
  },
  {
    "camera_id": "kodak_easyshare_slice",
    "display_name": "Kodak EasyShare SLICE",
    "brand": "Kodak",
    "series": "EasyShare SLICE",
    "release_year": null,
    "reason": "Camera existence confirmed, battery not yet source-verified",
    "candidate_source_name": "Camera-wiki Kodak catalog",
    "candidate_source_url": "https://camera-wiki.org/wiki/Kodak",
    "checked_source_urls": [
      "https://camera-wiki.org/wiki/Kodak"
    ],
    "last_checked": "2026-05-24"
  },
  {
    "camera_id": "kodak_easyshare_v1003",
    "display_name": "Kodak EasyShare V1003",
    "brand": "Kodak",
    "series": "EasyShare V",
    "release_year": null,
    "reason": "Camera existence confirmed, battery not yet source-verified",
    "candidate_source_name": "Camera-wiki Kodak catalog",
    "candidate_source_url": "https://camera-wiki.org/wiki/Kodak",
    "checked_source_urls": [
      "https://camera-wiki.org/wiki/Kodak"
    ],
    "last_checked": "2026-05-24"
  },
  {
    "camera_id": "kodak_easyshare_v1073",
    "display_name": "Kodak EasyShare V1073",
    "brand": "Kodak",
    "series": "EasyShare V",
    "release_year": null,
    "reason": "Camera existence confirmed, battery not yet source-verified",
    "candidate_source_name": "Camera-wiki Kodak catalog",
    "candidate_source_url": "https://camera-wiki.org/wiki/Kodak",
    "checked_source_urls": [
      "https://camera-wiki.org/wiki/Kodak"
    ],
    "last_checked": "2026-05-24"
  },
  {
    "camera_id": "kodak_easyshare_v1233",
    "display_name": "Kodak EasyShare V1233",
    "brand": "Kodak",
    "series": "EasyShare V",
    "release_year": null,
    "reason": "Camera existence confirmed, battery not yet source-verified",
    "candidate_source_name": "Camera-wiki Kodak catalog",
    "candidate_source_url": "https://camera-wiki.org/wiki/Kodak",
    "checked_source_urls": [
      "https://camera-wiki.org/wiki/Kodak"
    ],
    "last_checked": "2026-05-24"
  },
  {
    "camera_id": "kodak_easyshare_v1253",
    "display_name": "Kodak EasyShare V1253",
    "brand": "Kodak",
    "series": "EasyShare V",
    "release_year": null,
    "reason": "Camera existence confirmed, battery not yet source-verified",
    "candidate_source_name": "Camera-wiki Kodak catalog",
    "candidate_source_url": "https://camera-wiki.org/wiki/Kodak",
    "checked_source_urls": [
      "https://camera-wiki.org/wiki/Kodak"
    ],
    "last_checked": "2026-05-24"
  },
  {
    "camera_id": "kodak_easyshare_v1273",
    "display_name": "Kodak EasyShare V1273",
    "brand": "Kodak",
    "series": "EasyShare V",
    "release_year": null,
    "reason": "Camera existence confirmed, battery not yet source-verified",
    "candidate_source_name": "Camera-wiki Kodak catalog",
    "candidate_source_url": "https://camera-wiki.org/wiki/Kodak",
    "checked_source_urls": [
      "https://camera-wiki.org/wiki/Kodak"
    ],
    "last_checked": "2026-05-24"
  },
  {
    "camera_id": "kodak_easyshare_v530",
    "display_name": "Kodak EasyShare V530",
    "brand": "Kodak",
    "series": "EasyShare V",
    "release_year": null,
    "reason": "Camera existence confirmed, battery not yet source-verified",
    "candidate_source_name": "Camera-wiki Kodak catalog",
    "candidate_source_url": "https://camera-wiki.org/wiki/Kodak",
    "checked_source_urls": [
      "https://camera-wiki.org/wiki/Kodak"
    ],
    "last_checked": "2026-05-24"
  },
  {
    "camera_id": "kodak_easyshare_v550",
    "display_name": "Kodak EasyShare V550",
    "brand": "Kodak",
    "series": "EasyShare V",
    "release_year": null,
    "reason": "Camera existence confirmed, battery not yet source-verified",
    "candidate_source_name": "Camera-wiki Kodak catalog",
    "candidate_source_url": "https://camera-wiki.org/wiki/Kodak",
    "checked_source_urls": [
      "https://camera-wiki.org/wiki/Kodak"
    ],
    "last_checked": "2026-05-24"
  },
  {
    "camera_id": "kodak_easyshare_v570",
    "display_name": "Kodak EasyShare V570",
    "brand": "Kodak",
    "series": "EasyShare V",
    "release_year": null,
    "reason": "Camera existence confirmed, battery not yet source-verified",
    "candidate_source_name": "Camera-wiki Kodak catalog",
    "candidate_source_url": "https://camera-wiki.org/wiki/Kodak",
    "checked_source_urls": [
      "https://camera-wiki.org/wiki/Kodak"
    ],
    "last_checked": "2026-05-24"
  },
  {
    "camera_id": "kodak_easyshare_v603",
    "display_name": "Kodak EasyShare V603",
    "brand": "Kodak",
    "series": "EasyShare V",
    "release_year": null,
    "reason": "Camera existence confirmed, battery not yet source-verified",
    "candidate_source_name": "Camera-wiki Kodak catalog",
    "candidate_source_url": "https://camera-wiki.org/wiki/Kodak",
    "checked_source_urls": [
      "https://camera-wiki.org/wiki/Kodak"
    ],
    "last_checked": "2026-05-24"
  },
  {
    "camera_id": "kodak_easyshare_v610",
    "display_name": "Kodak EasyShare V610",
    "brand": "Kodak",
    "series": "EasyShare V",
    "release_year": null,
    "reason": "Camera existence confirmed, battery not yet source-verified",
    "candidate_source_name": "Camera-wiki Kodak catalog",
    "candidate_source_url": "https://camera-wiki.org/wiki/Kodak",
    "checked_source_urls": [
      "https://camera-wiki.org/wiki/Kodak"
    ],
    "last_checked": "2026-05-24"
  },
  {
    "camera_id": "kodak_easyshare_v705",
    "display_name": "Kodak EasyShare V705",
    "brand": "Kodak",
    "series": "EasyShare V",
    "release_year": null,
    "reason": "Camera existence confirmed, battery not yet source-verified",
    "candidate_source_name": "Camera-wiki Kodak catalog",
    "candidate_source_url": "https://camera-wiki.org/wiki/Kodak",
    "checked_source_urls": [
      "https://camera-wiki.org/wiki/Kodak"
    ],
    "last_checked": "2026-05-24"
  },
  {
    "camera_id": "kodak_easyshare_v803",
    "display_name": "Kodak EasyShare V803",
    "brand": "Kodak",
    "series": "EasyShare V",
    "release_year": null,
    "reason": "Camera existence confirmed, battery not yet source-verified",
    "candidate_source_name": "Camera-wiki Kodak catalog",
    "candidate_source_url": "https://camera-wiki.org/wiki/Kodak",
    "checked_source_urls": [
      "https://camera-wiki.org/wiki/Kodak"
    ],
    "last_checked": "2026-05-24"
  },
  {
    "camera_id": "kodak_easyshare_v830",
    "display_name": "Kodak EasyShare V830",
    "brand": "Kodak",
    "series": "EasyShare V",
    "release_year": null,
    "reason": "Camera existence confirmed, battery not yet source-verified",
    "candidate_source_name": "Camera-wiki Kodak catalog",
    "candidate_source_url": "https://camera-wiki.org/wiki/Kodak",
    "checked_source_urls": [
      "https://camera-wiki.org/wiki/Kodak"
    ],
    "last_checked": "2026-05-24"
  },
  {
    "camera_id": "kodak_easyshare_z5010",
    "display_name": "Kodak EasyShare Z5010",
    "brand": "Kodak",
    "series": "EasyShare Z",
    "release_year": null,
    "reason": "Direct research attempted; readable manual section did not specify an exact battery model or cell quantity.",